{
  "schemaVersion": "chronicle.dev/public-case-evidence/v1alpha1",
  "kind": "PublicCaseEvidence",
  "caseId": "r6-on-time-control",
  "claimId": "R6-control",
  "role": "control",
  "capturedAt": "2026-08-14T09:39:20Z",
  "source": {
    "commit": "e8246817012c1556dcd82593b8761dda833d0416",
    "tree": "e1bed4d2b4f2540d23ad8cf7b2de565879b95010",
    "binarySha256": "4b384088002505e1813e31e4425d7582688d362ef12ac46230796cd51ffa752f",
    "binaryCommit": "e824681",
    "argv": [
      "bin/chronicle",
      "run",
      "--scenario",
      "examples/order-lifecycle/scenarios/r6-on-time-cancellation-control.yaml",
      "--baseline",
      "examples/order-lifecycle/targets/generated/state-baseline.yaml",
      "--candidate",
      "examples/order-lifecycle/targets/generated/state-r6-candidate.yaml",
      "--out",
      "run/release-evidence/r6-on-time-control/raw",
      "--development-local-images",
      "--json",
      "--no-minimize"
    ],
    "inputs": [
      {
        "path": "config/images.lock.json",
        "sha256": "abd84f54373973b2c85a687fffcea726cf3a59a634e1d83eca863e8d9227aaf3"
      },
      {
        "path": "evidence/corpus.json",
        "sha256": "16751a3b097bd9b1849d658f350eeb4579be250f84d906a8232c4003ca5d3e5b"
      },
      {
        "path": "examples/order-lifecycle/scenarios/queries/order-status.sql",
        "sha256": "bfedfed7cdca7a59bc5e5a35258121748be1969d01bbd478eaef8508a1de7814"
      },
      {
        "path": "examples/order-lifecycle/scenarios/r6-on-time-cancellation-control.yaml",
        "sha256": "8fa5cf939790ebd9c5be7d1efe7dcfd85969cd481794442e3ce515f85739d989"
      },
      {
        "path": "examples/order-lifecycle/targets/generated/state-baseline.yaml",
        "sha256": "32172a61aa6160c47894e33bfc7211e99f6eb33690cd9e61478c46281bc1fe6b"
      },
      {
        "path": "examples/order-lifecycle/targets/generated/state-r6-candidate.yaml",
        "sha256": "63a04740bd7b011642e4b622f4ce1448ca140c4899d003e96404bb6965ea7c6f"
      }
    ]
  },
  "outcome": {
    "exitCode": 0,
    "state": "COMPLETE",
    "classification": "PASS",
    "failureSignature": null,
    "confirmations": 0,
    "baselineAttempts": 1,
    "candidateAttempts": 3,
    "observations": [
      {
        "role": "baseline",
        "observerId": "order-status",
        "type": "sql",
        "count": 1,
        "rawSchemaValid": true
      },
      {
        "role": "candidate-1",
        "observerId": "order-status",
        "type": "sql",
        "count": 1,
        "rawSchemaValid": true
      },
      {
        "role": "candidate-2",
        "observerId": "order-status",
        "type": "sql",
        "count": 1,
        "rawSchemaValid": true
      },
      {
        "role": "candidate-3",
        "observerId": "order-status",
        "type": "sql",
        "count": 1,
        "rawSchemaValid": true
      }
    ]
  },
  "reduction": {
    "status": "skipped",
    "minimality": "unavailable",
    "originalEvents": 0,
    "finalEvents": 0,
    "originalActions": 0,
    "finalActions": 0,
    "trials": 0
  },
  "artifacts": {
    "resultSha256": "ded0ced042a239999dccff65ee229d4516564f0f8dd8badf8a38c65aa6556e88",
    "checksumsSha256": "55e97fd3b3b5cb9363afb3b1aa522ff04b79f383568cf6a6d9ade2c25586ed7d",
    "journalSha256": "47af9400e006893446c41a09a4c2500357bd8d5afe06bd42ec42450595b531e2",
    "bundleSha256": null
  },
  "boundary": "Synthetic local comparative evidence demonstrates only the declared ChronicleGate scenarios and does not establish production reliability or capacity."
}
