{
  "schemaVersion": "chronicle.dev/public-case-evidence/v1alpha1",
  "kind": "PublicCaseEvidence",
  "caseId": "r3-stale-aggregate",
  "claimId": "R3",
  "role": "regression",
  "capturedAt": "2026-08-14T09:23:16Z",
  "source": {
    "commit": "e8246817012c1556dcd82593b8761dda833d0416",
    "tree": "e1bed4d2b4f2540d23ad8cf7b2de565879b95010",
    "binarySha256": "4b384088002505e1813e31e4425d7582688d362ef12ac46230796cd51ffa752f",
    "binaryCommit": "e824681",
    "argv": [
      "bin/chronicle",
      "run",
      "--scenario",
      "examples/order-lifecycle/scenarios/r3-stale-aggregate-overwrite.yaml",
      "--baseline",
      "examples/order-lifecycle/targets/generated/state-baseline.yaml",
      "--candidate",
      "examples/order-lifecycle/targets/generated/state-r3-candidate.yaml",
      "--out",
      "run/release-evidence/r3-stale-aggregate/raw",
      "--development-local-images",
      "--json",
      "--no-minimize"
    ],
    "inputs": [
      {
        "path": "config/images.lock.json",
        "sha256": "abd84f54373973b2c85a687fffcea726cf3a59a634e1d83eca863e8d9227aaf3"
      },
      {
        "path": "evidence/corpus.json",
        "sha256": "16751a3b097bd9b1849d658f350eeb4579be250f84d906a8232c4003ca5d3e5b"
      },
      {
        "path": "examples/order-lifecycle/expected/r3-signature.json",
        "sha256": "45e31567c0f8c1de8700654e812bbdfa933cf04c71a5ee36c0957e24d802ed17"
      },
      {
        "path": "examples/order-lifecycle/scenarios/queries/order-version.sql",
        "sha256": "b54e7ab85814b3047dd5b4dcb5243933976fc411f07c6ad485b4d7e1ee0e9f78"
      },
      {
        "path": "examples/order-lifecycle/scenarios/r3-stale-aggregate-overwrite.yaml",
        "sha256": "7fedb396b4e5c25a895977f88ce4866cfdee680ffad00f073cd0dee1cf829708"
      },
      {
        "path": "examples/order-lifecycle/targets/generated/state-baseline.yaml",
        "sha256": "32172a61aa6160c47894e33bfc7211e99f6eb33690cd9e61478c46281bc1fe6b"
      },
      {
        "path": "examples/order-lifecycle/targets/generated/state-r3-candidate.yaml",
        "sha256": "cf50c8c87b6e4ed4664f5056640171904478ff766b1c20a778bfc4d6797bc8eb"
      }
    ]
  },
  "outcome": {
    "exitCode": 2,
    "state": "COMPLETE",
    "classification": "SEMANTIC_REGRESSION",
    "failureSignature": {
      "invariantId": "order-version",
      "classification": "SEMANTIC_REGRESSION",
      "observationId": "order-version",
      "rowKey": "",
      "pointer": "/rows/0/aggregate_version",
      "expected": 2,
      "actual": 1,
      "digest": "299ffe3cd73f28980cc07879aaf96082b1f2b9216ba5b33325c37704cb84524a"
    },
    "confirmations": 2,
    "baselineAttempts": 1,
    "candidateAttempts": 3,
    "observations": [
      {
        "role": "baseline",
        "observerId": "order-version",
        "type": "sql",
        "count": 1,
        "rawSchemaValid": true
      },
      {
        "role": "candidate-1",
        "observerId": "order-version",
        "type": "sql",
        "count": 1,
        "rawSchemaValid": true
      },
      {
        "role": "candidate-2",
        "observerId": "order-version",
        "type": "sql",
        "count": 1,
        "rawSchemaValid": true
      },
      {
        "role": "candidate-3",
        "observerId": "order-version",
        "type": "sql",
        "count": 1,
        "rawSchemaValid": true
      }
    ]
  },
  "reduction": {
    "status": "skipped",
    "minimality": "unavailable",
    "originalEvents": 0,
    "finalEvents": 0,
    "originalActions": 0,
    "finalActions": 0,
    "trials": 0
  },
  "artifacts": {
    "resultSha256": "e5d3725a4fff379a32f851f3e39150eeedf41c19ad1ee2d7b39624629d0b78f3",
    "checksumsSha256": "18e37ab79dee274aa3dc62f91768833cca36c1f7c14bc5798a89adaed82dfa59",
    "journalSha256": "4d5b28ca15a11da44a08ee9f2a4699e0e6f1629be9666f825f8bfddf14fbd160",
    "bundleSha256": "ceaf8753c5f18e397f7c3d180d78b063ee9f069c667abbb7befa40fbe99d155f"
  },
  "boundary": "Synthetic local comparative evidence demonstrates only the declared ChronicleGate scenarios and does not establish production reliability or capacity."
}
