{
  "schemaVersion": "chronicle.dev/public-case-evidence/v1alpha1",
  "kind": "PublicCaseEvidence",
  "caseId": "r7-outbox-crash",
  "claimId": "R7",
  "role": "regression",
  "capturedAt": "2026-08-14T09:40:52Z",
  "source": {
    "commit": "e8246817012c1556dcd82593b8761dda833d0416",
    "tree": "e1bed4d2b4f2540d23ad8cf7b2de565879b95010",
    "binarySha256": "4b384088002505e1813e31e4425d7582688d362ef12ac46230796cd51ffa752f",
    "binaryCommit": "e824681",
    "argv": [
      "bin/chronicle",
      "run",
      "--scenario",
      "examples/order-lifecycle/scenarios/r7-outbox-crash-after-ack.yaml",
      "--baseline",
      "examples/order-lifecycle/targets/generated/r7-baseline.yaml",
      "--candidate",
      "examples/order-lifecycle/targets/generated/r7-candidate.yaml",
      "--out",
      "run/release-evidence/r7-outbox-crash/raw",
      "--development-local-images",
      "--json",
      "--no-minimize"
    ],
    "inputs": [
      {
        "path": "config/images.lock.json",
        "sha256": "abd84f54373973b2c85a687fffcea726cf3a59a634e1d83eca863e8d9227aaf3"
      },
      {
        "path": "evidence/corpus.json",
        "sha256": "16751a3b097bd9b1849d658f350eeb4579be250f84d906a8232c4003ca5d3e5b"
      },
      {
        "path": "examples/order-lifecycle/expected/r7-signature.json",
        "sha256": "cc1c4f15968b0fb2891bcf5e2be634f407a125e9c5cba2583d3584b8571c69c9"
      },
      {
        "path": "examples/order-lifecycle/scenarios/queries/duplicate-outbox-business-operations.sql",
        "sha256": "a35c9cbf886d6b543e2cea65dbdbf451b585203729258c645aa5f96242bce1e3"
      },
      {
        "path": "examples/order-lifecycle/scenarios/queries/outbox-terminal.sql",
        "sha256": "3900918111d9ee1c8a56b720f851293c7855f648eabb0454a786943789e7541e"
      },
      {
        "path": "examples/order-lifecycle/scenarios/r7-outbox-crash-after-ack.yaml",
        "sha256": "958eba79a15e94f5260ce1a0aa7315d239a937e43e43f373947bdb673cafc969"
      },
      {
        "path": "examples/order-lifecycle/scenarios/schemas/outbox-relay-trigger.schema.json",
        "sha256": "c791c31d3e3389f12fab5cef3918cace5b43d5242cc05da4753f15db8935f098"
      },
      {
        "path": "examples/order-lifecycle/targets/generated/r7-baseline.yaml",
        "sha256": "277222397c3019b08e71822709a32968f51ef0ab60d7121a49ec024e5d6a1430"
      },
      {
        "path": "examples/order-lifecycle/targets/generated/r7-candidate.yaml",
        "sha256": "406c87035d81adcbb59d64bb45f0d9d56973d47c3d78616fba958bcf9c7201ef"
      }
    ]
  },
  "outcome": {
    "exitCode": 2,
    "state": "COMPLETE",
    "classification": "EXTERNAL_EFFECT_REGRESSION",
    "failureSignature": {
      "invariantId": "capture-effects",
      "classification": "EXTERNAL_EFFECT_REGRESSION",
      "observationId": "capture-effects",
      "rowKey": "effect-ledger",
      "pointer": "/entries/count",
      "expected": 1,
      "actual": 2,
      "digest": "b6a2655ffc67568d7255c2d10fd7f70c1fb037cf206c68d82bde024e7aa823c4"
    },
    "confirmations": 2,
    "baselineAttempts": 1,
    "candidateAttempts": 3,
    "observations": [
      {
        "role": "baseline",
        "observerId": "capture-effects",
        "type": "effects",
        "count": 1,
        "rawSchemaValid": true
      },
      {
        "role": "baseline",
        "observerId": "fulfillment-state",
        "type": "http",
        "count": 1,
        "rawSchemaValid": true
      },
      {
        "role": "baseline",
        "observerId": "outbox-state",
        "type": "sql",
        "count": 1,
        "rawSchemaValid": true
      },
      {
        "role": "candidate-1",
        "observerId": "capture-effects",
        "type": "effects",
        "count": 2,
        "rawSchemaValid": true
      },
      {
        "role": "candidate-1",
        "observerId": "fulfillment-state",
        "type": "http",
        "count": 1,
        "rawSchemaValid": true
      },
      {
        "role": "candidate-1",
        "observerId": "outbox-state",
        "type": "sql",
        "count": 1,
        "rawSchemaValid": true
      },
      {
        "role": "candidate-2",
        "observerId": "capture-effects",
        "type": "effects",
        "count": 2,
        "rawSchemaValid": true
      },
      {
        "role": "candidate-2",
        "observerId": "fulfillment-state",
        "type": "http",
        "count": 1,
        "rawSchemaValid": true
      },
      {
        "role": "candidate-2",
        "observerId": "outbox-state",
        "type": "sql",
        "count": 1,
        "rawSchemaValid": true
      },
      {
        "role": "candidate-3",
        "observerId": "capture-effects",
        "type": "effects",
        "count": 2,
        "rawSchemaValid": true
      },
      {
        "role": "candidate-3",
        "observerId": "fulfillment-state",
        "type": "http",
        "count": 1,
        "rawSchemaValid": true
      },
      {
        "role": "candidate-3",
        "observerId": "outbox-state",
        "type": "sql",
        "count": 1,
        "rawSchemaValid": true
      }
    ]
  },
  "reduction": {
    "status": "skipped",
    "minimality": "unavailable",
    "originalEvents": 0,
    "finalEvents": 0,
    "originalActions": 0,
    "finalActions": 0,
    "trials": 0
  },
  "artifacts": {
    "resultSha256": "268803d6315943907bcb2667d735afc96d922dec1a3a7175751a1b7297fd862c",
    "checksumsSha256": "ec4cdd855688cc189435a23e1806e6eb172cf9fd60d0791522bd43730cde3f74",
    "journalSha256": "5cea19920b32e10711addeadf26dce806b0866aee5a6251eb1ad1322d52a92a8",
    "bundleSha256": "af7d0df79158dd2d6873f13e889857bfe58ff5fe0fd0953357bfe6cf4ef1ac2a"
  },
  "boundary": "Synthetic local comparative evidence demonstrates only the declared ChronicleGate scenarios and does not establish production reliability or capacity."
}
