{
  "schemaVersion": "chronicle.dev/public-case-evidence/v1alpha1",
  "kind": "PublicCaseEvidence",
  "caseId": "r2-crash-after-effect",
  "claimId": "R2",
  "role": "regression",
  "capturedAt": "2026-08-14T09:21:51Z",
  "source": {
    "commit": "e8246817012c1556dcd82593b8761dda833d0416",
    "tree": "e1bed4d2b4f2540d23ad8cf7b2de565879b95010",
    "binarySha256": "4b384088002505e1813e31e4425d7582688d362ef12ac46230796cd51ffa752f",
    "binaryCommit": "e824681",
    "argv": [
      "bin/chronicle",
      "run",
      "--scenario",
      "examples/order-lifecycle/scenarios/r2-crash-after-effect.yaml",
      "--baseline",
      "examples/order-lifecycle/targets/generated/r2-baseline.yaml",
      "--candidate",
      "examples/order-lifecycle/targets/generated/r2-candidate.yaml",
      "--out",
      "run/release-evidence/r2-crash-after-effect/raw",
      "--development-local-images",
      "--json",
      "--no-minimize"
    ],
    "inputs": [
      {
        "path": "config/images.lock.json",
        "sha256": "abd84f54373973b2c85a687fffcea726cf3a59a634e1d83eca863e8d9227aaf3"
      },
      {
        "path": "evidence/corpus.json",
        "sha256": "16751a3b097bd9b1849d658f350eeb4579be250f84d906a8232c4003ca5d3e5b"
      },
      {
        "path": "examples/order-lifecycle/expected/r2-signature.json",
        "sha256": "d76fc9e2fe17e425f01c33a23e932bf1d99884d21d96a4f3f287b80de7bb2f63"
      },
      {
        "path": "examples/order-lifecycle/scenarios/queries/duplicate-processed-events.sql",
        "sha256": "5201b762f995a1e53c24357bbb19c4d2b1d9a55feb8bb012e9702ba11805c78d"
      },
      {
        "path": "examples/order-lifecycle/scenarios/r2-crash-after-effect.yaml",
        "sha256": "1de807359d39c362881d84ebe3157b2142c48d1a4916696447fda7584dfced23"
      },
      {
        "path": "examples/order-lifecycle/scenarios/schemas/payment-requested.schema.json",
        "sha256": "079c490910b16b8be7cae7107b4b94a77e83a91fdb478511682b8da95c129667"
      },
      {
        "path": "examples/order-lifecycle/targets/generated/r2-baseline.yaml",
        "sha256": "273f8e7a478a825419dbf0d024ff18626fd1f13b63c34304ce54634aa91a63ff"
      },
      {
        "path": "examples/order-lifecycle/targets/generated/r2-candidate.yaml",
        "sha256": "2abb55578c15fdd01cda1d9a342071addaa21584a378fcb309b8b611c2245691"
      }
    ]
  },
  "outcome": {
    "exitCode": 2,
    "state": "COMPLETE",
    "classification": "EXTERNAL_EFFECT_REGRESSION",
    "failureSignature": {
      "invariantId": "one-capture-per-business-operation",
      "classification": "EXTERNAL_EFFECT_REGRESSION",
      "observationId": "capture-effects",
      "rowKey": "business_key=order-1",
      "pointer": "/entries/count",
      "expected": 1,
      "actual": 2,
      "digest": "34904ab76052369ba67bbc30ae12855b0665c884c24b92ec31c081388176fc17"
    },
    "confirmations": 2,
    "baselineAttempts": 1,
    "candidateAttempts": 3,
    "observations": [
      {
        "role": "baseline",
        "observerId": "capture-effects",
        "type": "effects",
        "count": 1,
        "rawSchemaValid": true
      },
      {
        "role": "candidate-1",
        "observerId": "capture-effects",
        "type": "effects",
        "count": 1,
        "rawSchemaValid": true
      },
      {
        "role": "candidate-2",
        "observerId": "capture-effects",
        "type": "effects",
        "count": 1,
        "rawSchemaValid": true
      },
      {
        "role": "candidate-3",
        "observerId": "capture-effects",
        "type": "effects",
        "count": 1,
        "rawSchemaValid": true
      }
    ]
  },
  "reduction": {
    "status": "skipped",
    "minimality": "unavailable",
    "originalEvents": 0,
    "finalEvents": 0,
    "originalActions": 0,
    "finalActions": 0,
    "trials": 0
  },
  "artifacts": {
    "resultSha256": "b888000a0328878b695e0e1e78a063814077f74e2bbd2ec23aa7a8fce6860dd8",
    "checksumsSha256": "59f00af1ce127dec74ceaf8dc687a2f57943ff3757bf162313e708a1836513db",
    "journalSha256": "9f0bff47983766afd99a0fc4bc8edf7491d66a5c408903532ef40043fecce644",
    "bundleSha256": "54ddba9732b0213174ca45d8484bc9c29f347ac96315a6a297f9acea7b09d7b9"
  },
  "boundary": "Synthetic local comparative evidence demonstrates only the declared ChronicleGate scenarios and does not establish production reliability or capacity."
}
