{
  "schemaVersion": "chronicle.dev/public-case-evidence/v1alpha1",
  "kind": "PublicCaseEvidence",
  "caseId": "r5-payment-first-control",
  "claimId": "R5-control",
  "role": "control",
  "capturedAt": "2026-08-14T09:29:48Z",
  "source": {
    "commit": "e8246817012c1556dcd82593b8761dda833d0416",
    "tree": "e1bed4d2b4f2540d23ad8cf7b2de565879b95010",
    "binarySha256": "4b384088002505e1813e31e4425d7582688d362ef12ac46230796cd51ffa752f",
    "binaryCommit": "e824681",
    "argv": [
      "bin/chronicle",
      "run",
      "--scenario",
      "examples/order-lifecycle/scenarios/r5-payment-first-control.yaml",
      "--baseline",
      "examples/order-lifecycle/targets/generated/state-baseline.yaml",
      "--candidate",
      "examples/order-lifecycle/targets/generated/state-r5-candidate.yaml",
      "--out",
      "run/release-evidence/r5-payment-first-control/raw",
      "--development-local-images",
      "--json",
      "--no-minimize"
    ],
    "inputs": [
      {
        "path": "config/images.lock.json",
        "sha256": "abd84f54373973b2c85a687fffcea726cf3a59a634e1d83eca863e8d9227aaf3"
      },
      {
        "path": "evidence/corpus.json",
        "sha256": "16751a3b097bd9b1849d658f350eeb4579be250f84d906a8232c4003ca5d3e5b"
      },
      {
        "path": "examples/order-lifecycle/scenarios/queries/order-status.sql",
        "sha256": "bfedfed7cdca7a59bc5e5a35258121748be1969d01bbd478eaef8508a1de7814"
      },
      {
        "path": "examples/order-lifecycle/scenarios/r5-payment-first-control.yaml",
        "sha256": "217867cc972512fc4ace64c49f87648f85b814ba7f7ac905b5fc2f5ed191413a"
      },
      {
        "path": "examples/order-lifecycle/targets/generated/state-baseline.yaml",
        "sha256": "32172a61aa6160c47894e33bfc7211e99f6eb33690cd9e61478c46281bc1fe6b"
      },
      {
        "path": "examples/order-lifecycle/targets/generated/state-r5-candidate.yaml",
        "sha256": "140c3cc9b66816580d201d2d2034181fabc4624f3e7f90787179da7923031277"
      }
    ]
  },
  "outcome": {
    "exitCode": 0,
    "state": "COMPLETE",
    "classification": "PASS",
    "failureSignature": null,
    "confirmations": 0,
    "baselineAttempts": 1,
    "candidateAttempts": 3,
    "observations": [
      {
        "role": "baseline",
        "observerId": "order-status",
        "type": "sql",
        "count": 1,
        "rawSchemaValid": true
      },
      {
        "role": "candidate-1",
        "observerId": "order-status",
        "type": "sql",
        "count": 1,
        "rawSchemaValid": true
      },
      {
        "role": "candidate-2",
        "observerId": "order-status",
        "type": "sql",
        "count": 1,
        "rawSchemaValid": true
      },
      {
        "role": "candidate-3",
        "observerId": "order-status",
        "type": "sql",
        "count": 1,
        "rawSchemaValid": true
      }
    ]
  },
  "reduction": {
    "status": "skipped",
    "minimality": "unavailable",
    "originalEvents": 0,
    "finalEvents": 0,
    "originalActions": 0,
    "finalActions": 0,
    "trials": 0
  },
  "artifacts": {
    "resultSha256": "6610c7925bd851b746a1e3878bcd766e338abb5fec9ee2694abba7b2c0c4fabb",
    "checksumsSha256": "911d132871700aff00dea944e3d6830864fac5083156de32e541d87e63cf6c95",
    "journalSha256": "1cbaf82013889af9ab6a61fed602b0573901ffa4cb7158e3cc15a84eeacc0234",
    "bundleSha256": null
  },
  "boundary": "Synthetic local comparative evidence demonstrates only the declared ChronicleGate scenarios and does not establish production reliability or capacity."
}
